id,titulo,tipo,ano_publicacao,volume,paginas,organizacoes,citacoes,issn,isbn,doi,orcids_autores,autores,origem,keywords
SCOPUS_ID:85139922891,"A method for verifying compliance with the General Data Protection Regulation - a proposal to adapt an Information Security Management System","Conference Proceeding",2021-01-01,2021-October,undefined,N/A,N/A,undefined,undefined,undefined,0000-0002-7556-4367,"Isabel Sofia Sousa Brito",Scopus,
SCOPUS_ID:85118101372,"A Sustainability Requirements Catalog for the Social and Technical Dimensions","Book Series",2021-01-01,"13011 LNCS",381-394,N/A,N/A,03029743,"true, [9783030890216]",10.1007/978-3-030-89022-3_30,0000-0002-7556-4367,"Isabel Sofia Sousa Brito",Scopus,
SCOPUS_ID:85091321949,"Discovering Spatio-Temporal Patterns in Precision Agriculture Based on Triclustering","Book Series",2021-01-01,"1268 AISC",226-236,N/A,N/A,21945357,"true, [9783030578015]",10.1007/978-3-030-57802-2_22,0000-0002-7556-4367,"Isabel Sofia Sousa Brito",Scopus,
SCOPUS_ID:85098730975,"Data integration for infrastructure asset management in small to medium-sized water utilities",Journal,2020-12-15,82,2737-2744,N/A,N/A,02731223,undefined,10.2166/wst.2020.377,0000-0002-7556-4367,"Isabel Sofia Sousa Brito",Scopus,
SCOPUS_ID:85128336167,"The Effects of Industry 4.0 in Tourism and Hospitality and Future Trends in Portugal",Book,2020-01-01,undefined,367-378,N/A,N/A,undefined,"true, [9781839826887, 9781839826894]",10.1108/978-1-83982-688-720201023,0000-0002-7556-4367,"Isabel Sofia Sousa Brito",Scopus,
SCOPUS_ID:85092305126,"Handling nonfunctional requirements for smart cities","Conference Proceeding",2020-01-01,undefined,undefined,N/A,N/A,undefined,undefined,undefined,0000-0002-7556-4367,"Isabel Sofia Sousa Brito",Scopus,
SCOPUS_ID:85068474078,Preface,"Conference Proceeding",2019-01-01,undefined,I-II,N/A,N/A,undefined,undefined,undefined,0000-0002-7556-4367,"Isabel Sofia Sousa Brito",Scopus,
SCOPUS_ID:85050862039,"A concern-oriented sustainability approach","Conference Proceeding",2018-07-06,2018-May,1-12,N/A,N/A,21511349,"true, [9781538665176]",10.1109/RCIS.2018.8406676,0000-0002-7556-4367,"Isabel Sofia Sousa Brito",Scopus,
SCOPUS_ID:85032812975,"Software Requirements Analyst Profile: A Descriptive Study of Brazil and Mexico","Conference Proceeding",2017-09-22,undefined,204-212,N/A,N/A,undefined,"true, [9781538631911]",10.1109/RE.2017.22,0000-0002-7556-4367,"Isabel Sofia Sousa Brito",Scopus,
SCOPUS_ID:85044466453,"Towards automatic code generation for distributed cyber-physical systems: A first prototype for arduino boards","Conference Proceeding",2017-06-28,undefined,1-4,N/A,N/A,19460740,"true, [9781509065059]",10.1109/ETFA.2017.8247737,0000-0002-7556-4367,"Isabel Sofia Sousa Brito",Scopus,
SCOPUS_ID:85023595133,"Student perspectives on the use of a Java library for novices","Conference Proceeding",2017-06-07,undefined,1405-1410,N/A,N/A,21659559,"true, [9781509054671]",10.1109/EDUCON.2017.7943031,0000-0002-7556-4367,"Isabel Sofia Sousa Brito",Scopus,
SCOPUS_ID:85013119849,"Modeling the impact of UAVs in sustainability","Conference Proceeding",2017-01-12,undefined,208-216,N/A,N/A,undefined,"true, [9781509036943]",10.1109/REW.2016.33,0000-0002-7556-4367,"Isabel Sofia Sousa Brito",Scopus,
SCOPUS_ID:85043229700,"Towards an information system for information dissemination for an integrated management systems QHSE","Conference Proceeding",2017-01-01,17,233-244,N/A,N/A,undefined,undefined,10.18803/capsi.v17.233-244,0000-0002-7556-4367,"Isabel Sofia Sousa Brito",Scopus,
SCOPUS_ID:85012866427,"From requirements to code (Re2Code) - A model-based approach for controller implementation","Conference Proceeding",2016-07-02,0,1224-1230,N/A,N/A,19354576,"true, [9781509028702]",10.1109/INDIN.2016.7819354,0000-0002-7556-4367,"Isabel Sofia Sousa Brito",Scopus,
SCOPUS_ID:84988360207,"Trends and needs in requirements engineering research in Ibero-America: Insights from a panel","Conference Proceeding",2016-04-01,undefined,436-441,N/A,N/A,undefined,"true, [9789978301814]",undefined,0000-0002-7556-4367,"Isabel Sofia Sousa Brito",Scopus,
SCOPUS_ID:84964645546,"Qualitative assessment of access control in a database management system","Conference Proceeding",2016-01-04,undefined,undefined,N/A,N/A,undefined,"true, [9781467386111]",10.1109/ICISSEC.2015.7371026,0000-0002-7556-4367,"Isabel Sofia Sousa Brito",Scopus,
SCOPUS_ID:84949484238,"Controller design and implementation: An approach based on problem frames and Petri Net models","Conference Proceeding",2015-09-28,undefined,860-867,N/A,N/A,undefined,"true, [9781479966493]",10.1109/INDIN.2015.7281849,0000-0002-7556-4367,"Isabel Sofia Sousa Brito",Scopus,
SCOPUS_ID:85089557935,"Trends and needs in requirements engineering research in Ibero-America","Conference Proceeding",2015-01-01,undefined,undefined,N/A,N/A,undefined,"true, [9789972825804]",undefined,0000-0002-7556-4367,"Isabel Sofia Sousa Brito",Scopus,
SCOPUS_ID:84936070584,"Track3: Workshop on Requirements Engineering (WER2015) Preface","Conference Proceeding",2015-01-01,undefined,517,N/A,N/A,undefined,"true, [9789972825804]",undefined,0000-0002-7556-4367,"Isabel Sofia Sousa Brito",Scopus,
SCOPUS_ID:84914104660,"Requirements specification for controller design - From use cases to IOPT net models","Conference Proceeding",2014-11-03,undefined,207-212,N/A,N/A,undefined,"true, [9781479949052]",10.1109/INDIN.2014.6945509,0000-0002-7556-4367,"Isabel Sofia Sousa Brito",Scopus,
SCOPUS_ID:84887121527,"SmartRestaurant: A report on the development of a NFC-based mobile application","Conference Proceeding",2013-11-11,undefined,322-327,N/A,N/A,undefined,"true, [9789898565686]",undefined,0000-0002-7556-4367,"Isabel Sofia Sousa Brito",Scopus,
SCOPUS_ID:84930022899,"Handling conflicts in aspect-oriented requirements engineering",Book,2013-11-01,9783642386404,225-241,N/A,N/A,undefined,"true, [9783642386404, 3642386393, 9783642386398]",10.1007/978-3-642-38640-4_12,0000-0002-7556-4367,"Isabel Sofia Sousa Brito",Scopus,
SCOPUS_ID:84892570338,"Coloured Petri net model of the bCMS system using CPN tools","Conference Proceeding",2013-01-01,undefined,7-12,N/A,N/A,undefined,"true, [9781479907793]",10.1109/CMA-RE.2013.6664178,0000-0002-7556-4367,"Isabel Sofia Sousa Brito",Scopus,
SCOPUS_ID:79959311541,"Aspect-oriented analysis for software product lines requirements engineering","Conference Proceeding",2011-06-23,undefined,667-674,N/A,N/A,undefined,"true, [9781450301138]",10.1145/1982185.1982333,0000-0002-7556-4367,"Isabel Sofia Sousa Brito",Scopus,
SCOPUS_ID:79551587941,"Using constraints for intrusion detection: The NeMODe system","Book Series",2011-02-08,"6539 LNCS",115-129,N/A,N/A,03029743,"true, [9783642183775]",10.1007/978-3-642-18378-2_11,0000-0002-7556-4367,"Isabel Sofia Sousa Brito",Scopus,
SCOPUS_ID:84887870834,"A metamodel for aspect-oriented analysis approach","Conference Proceeding",2010-12-01,undefined,199-212,N/A,N/A,undefined,"true, [9789978325100]",undefined,0000-0002-7556-4367,"Isabel Sofia Sousa Brito",Scopus,
SCOPUS_ID:79551603149,"Aspect-oriented specification: A case study in space domain",Journal,2010-01-01,20,783-808,N/A,N/A,02181940,undefined,10.1142/S0218194010004943,0000-0002-7556-4367,"Isabel Sofia Sousa Brito",Scopus,
SCOPUS_ID:55849132253,"A Metadata-driven approach for aspect-oriented requirements analysis","Conference Proceeding",2008-01-01,"2 ISAS",129-136,N/A,N/A,undefined,"true, [9789898111388]",undefined,0000-0002-7556-4367,"Isabel Sofia Sousa Brito",Scopus,
SCOPUS_ID:48749119468,"On the contributions of an end-to-end AOSD testbed 1","Conference Proceeding",2007-01-01,undefined,8-14,N/A,N/A,02705257,"true, [0769529577, 9780769529578]",10.1109/EARLYASPECTS.2007.8,0000-0002-7556-4367,"Isabel Sofia Sousa Brito",Scopus,
SCOPUS_ID:38549178856,"Handling conflicts in aspectual requirements compositions","Book Series",2007-01-01,"4620 LNCS",144-166,N/A,N/A,03029743,"true, [3540751610, 9783540751618]",10.1007/978-3-540-75162-5_6,0000-0002-7556-4367,"Isabel Sofia Sousa Brito",Scopus,
SCOPUS_ID:38549117144,"An XML-based language for specification and composition of aspectual concerns","Conference Proceeding",2006-12-01,ISAS,410-419,N/A,N/A,undefined,"true, [9728865430, 9789728865436]",undefined,0000-0002-7556-4367,"Isabel Sofia Sousa Brito",Scopus,
SCOPUS_ID:38049159995,"Tool support for aspect-oriented requirements","Conference Proceeding",2006-12-01,undefined,38-44,N/A,N/A,undefined,"true, [9780889865990]",undefined,0000-0002-7556-4367,"Isabel Sofia Sousa Brito",Ambas,N/A
SCOPUS_ID:41149170880,"Towards an integrated approach for aspectual requirements","Conference Proceeding",2006-01-01,undefined,341-342,N/A,N/A,1090705X,"true, [9780769525556]",10.1109/RE.2006.67,0000-0002-7556-4367,"Isabel Sofia Sousa Brito",Scopus,
SCOPUS_ID:0842333988,"A multiple objective mixed integer linear programming model for power generation expansion planning",Journal,2004-01-01,29,613-627,N/A,N/A,03605442,undefined,10.1016/j.energy.2003.10.012,0000-0002-7556-4367,"Isabel Sofia Sousa Brito",Ambas,N/A
SCOPUS_ID:79960337718,"Aspect-oriented software development: An overview","Conference Proceeding",2003-01-01,3,531-534,N/A,N/A,undefined,"true, [9729881618]",undefined,0000-0002-7556-4367,"Isabel Sofia Sousa Brito",Scopus,
SCOPUS_ID:77953781306,"Crosscutting quality attributes for requirements engineering","Conference Proceeding",2002-12-01,27,167-174,N/A,N/A,undefined,"true, [1581135564, 9781581135565]",10.1145/568760.568790,0000-0002-7556-4367,"Isabel Sofia Sousa Brito",Scopus,
SCOPUS_ID:85200986098,"Comparison of milk-clotting activity measurement using the Berridge's operator-based approach and a proposed digital method",Journal,2024-12-01,159,undefined,N/A,N/A,09586946,undefined,10.1016/j.idairyj.2024.106055,0000-0002-4567-7416,"João Carlos da Silva Martins",Scopus,
SCOPUS_ID:85135091413,"IoT Lysimeter System with Enhanced Data Security","Book Series",2022-01-01,"930 LNEE",119-129,N/A,N/A,18761100,"true, [9783031100468]",10.1007/978-3-031-10047-5_11,0000-0002-4567-7416,"João Carlos da Silva Martins",Scopus,
SCOPUS_ID:85126259233,"Hydric Resources and Meteorological Monitoring IoT System: The Software Architecture","Book Series",2022-01-01,"641 IFIP",252-267,N/A,N/A,18684238,"true, [9783030964658]",10.1007/978-3-030-96466-5_16,0000-0002-4567-7416,"João Carlos da Silva Martins",Scopus,
SCOPUS_ID:85126182712,"Smart Lysimeter with Crop and Environment Monitoring: Enhanced with Pest and Crop Control","Book Series",2022-01-01,"641 IFIP",48-63,N/A,N/A,18684238,"true, [9783030964658]",10.1007/978-3-030-96466-5_4,0000-0002-4567-7416,"João Carlos da Silva Martins",Scopus,
SCOPUS_ID:85093115477,"Impact of environmental conditions on the ripening of Queijo de Évora PDO cheese",Journal,2021-10-01,58,3942-3952,N/A,N/A,00221155,undefined,10.1007/s13197-020-04856-x,0000-0002-4567-7416,"João Carlos da Silva Martins",Scopus,
SCOPUS_ID:85111649570,"Applying computational fluid dynamics in the development of smart ripening rooms for traditional cheeses",Journal,2021-08-01,10,undefined,N/A,N/A,undefined,undefined,10.3390/foods10081716,0000-0002-4567-7416,"João Carlos da Silva Martins",Ambas,N/A
SCOPUS_ID:85128155966,"Automated remote control of cheese ripening chambers: Increasing economic value added while reducing the risk of transmission during the pandemic",Book,2021-06-11,undefined,442-460,N/A,N/A,undefined,"true, [9781799869276, 9781799869269]",10.4018/978-1-7998-6926-9.ch024,0000-0002-4567-7416,"João Carlos da Silva Martins",Scopus,
SCOPUS_ID:85121847719,"A Smart IoT System for Water Monitoring and Analysis","Book Series",2021-01-01,"401 LNICST",67-79,N/A,N/A,18678211,"true, [9783030914202]",10.1007/978-3-030-91421-9_6,0000-0002-4567-7416,"João Carlos da Silva Martins",Scopus,
SCOPUS_ID:85137921106,"Water management for rural environments and IoT",Book,2020-09-30,undefined,246-262,N/A,N/A,undefined,"true, [9781799853527, 9781799853510]",10.4018/978-1-7998-5351-0.ch015,0000-0002-4567-7416,"João Carlos da Silva Martins",Scopus,
SCOPUS_ID:85089819418,"The economic impact of a new type of ripening chamber in traditional cheese manufacturing",Journal,2020-08-01,12,undefined,N/A,N/A,undefined,undefined,10.3390/su12166682,0000-0002-4567-7416,"João Carlos da Silva Martins",Scopus,
SCOPUS_ID:84911923584,"Nonlinear system identification using constellation based multiple model adaptive estimators","Conference Proceeding",2014-11-10,undefined,1217-1221,N/A,N/A,22195491,"true, [9780992862619]",undefined,0000-0002-4567-7416,"João Carlos da Silva Martins",Scopus,
SCOPUS_ID:83455169066,"A new approach to system identification and parameter tuning with multiple model adaptive estimators","Conference Proceeding",2011-12-20,undefined,72-77,N/A,N/A,undefined,"true, [9789531841597]",undefined,0000-0002-4567-7416,"João Carlos da Silva Martins",Scopus,
SCOPUS_ID:67349105614,"Neural code metrics: Analysis and application to the assessment of neural models",Journal,2009-06-01,72,2337-2350,N/A,N/A,09252312,undefined,10.1016/j.neucom.2008.12.012,0000-0002-4567-7416,"João Carlos da Silva Martins",Scopus,
SCOPUS_ID:85115951330,"Bioelectronic vision: Retina models, evaluation metrics and system design",Book,2009-01-01,undefined,1-246,N/A,N/A,undefined,"true, [9789812794314, 9812794301, 9789812794307]",10.1142/6777,0000-0002-4567-7416,"João Carlos da Silva Martins",Scopus,
SCOPUS_ID:55649116193,"Towards a unified model for the retina: Static vs Dynamic integrate and fire models","Conference Proceeding",2008-11-13,2,528-533,N/A,N/A,undefined,"true, [9789898111180]",undefined,0000-0002-4567-7416,"João Carlos da Silva Martins",Scopus,
SCOPUS_ID:51849083441,"Instrumentation remote control through internet with PHP","Conference Proceeding",2008-09-22,undefined,41-44,N/A,N/A,undefined,"true, [9781424419289]",10.1109/VECIMS.2008.4592750,0000-0002-4567-7416,"João Carlos da Silva Martins",Scopus,
SCOPUS_ID:56149126474,"Parameters identification with the multiple model adaptive estimation (MMAE) algorithm","Conference Proceeding",2006-12-01,undefined,501-506,N/A,N/A,10258973,"true, [0889865515, 9780889865518]",undefined,0000-0002-4567-7416,"João Carlos da Silva Martins",Scopus,
SCOPUS_ID:48149103257,"Additive logistic regression applied to retina modelling","Conference Proceeding",2006-12-01,3,undefined,N/A,N/A,15224880,"true, [1424414377, 9781424414376]",10.1109/ICIP.2007.4379308,0000-0002-4567-7416,"João Carlos da Silva Martins",Scopus,
SCOPUS_ID:48149110914,"Performance comparison of computational retina models","Conference Proceeding",2005-12-01,undefined,156-161,N/A,N/A,undefined,"true, [0889865280, 9780889865280]",undefined,0000-0002-4567-7416,"João Carlos da Silva Martins",Ambas,N/A
SCOPUS_ID:85176446659,"Drought Characterization in Croatia Using E-OBS Gridded Data",Journal,2023-11-01,15,undefined,N/A,N/A,undefined,undefined,10.3390/w15213806,0000-0002-4671-9884,"João Filipe Fragoso dos Santos",Scopus,
SCOPUS_ID:85153445417,"Risk Analysis of Water Harvesting Systems",Book,2021-01-01,undefined,177-189,N/A,N/A,undefined,"true, [9781119478911, 9781119478959]",10.1002/9781119478911.ch12,0000-0002-4671-9884,"João Filipe Fragoso dos Santos",Scopus,
SCOPUS_ID:85076637453,"Jointly modeling drought characteristics with smoothed regionalized SPI series for a small island",Journal,2019-12-01,11,undefined,N/A,N/A,undefined,undefined,10.3390/w11122489,0000-0002-4671-9884,"João Filipe Fragoso dos Santos",Scopus,
SCOPUS_ID:85053171375,"Drought modeling methods",Book,2017-01-01,undefined,149-166,N/A,N/A,undefined,"true, [9781315404226, 9781498731027]",10.1201/9781315404219,0000-0002-4671-9884,"João Filipe Fragoso dos Santos",Scopus,
SCOPUS_ID:84938147391,"Drought analysis in southern Paraguay, Brazil and northern Argentina: Regionalization, occurrence rate and rainfall thresholds",Journal,2015-01-01,46,792-810,N/A,N/A,19989563,undefined,10.2166/nh.2014.074,0000-0002-4671-9884,"João Filipe Fragoso dos Santos",Scopus,
SCOPUS_ID:84920711365,"SPI Modes of Drought Spatial and Temporal Variability in Portugal: Comparing Observations, PT02 and GPCC Gridded Datasets",Journal,2015-01-01,29,487-504,N/A,N/A,09204741,undefined,10.1007/s11269-014-0690-3,0000-0002-4671-9884,"João Filipe Fragoso dos Santos",Scopus,
SCOPUS_ID:84891748082,"Spring drought prediction based on winter NAO and global SST in Portugal",Journal,2014-01-30,28,1009-1024,N/A,N/A,08856087,undefined,10.1002/hyp.9641,0000-0002-4671-9884,"João Filipe Fragoso dos Santos",Scopus,
SCOPUS_ID:85010871778,"Trends in rainfall and streamflow series: Portuguese case studies",Journal,2014-01-01,4,221-248,N/A,N/A,20419031,undefined,10.2495/SAFE-V4-N3-221-248,0000-0002-4671-9884,"João Filipe Fragoso dos Santos",Scopus,
SCOPUS_ID:84977468493,"Analysis of temporal variability of droughts in southern Paraguay and northern Argentina (1961–2011)","Book Series",2014-01-01,undefined,31-46,N/A,N/A,16102002,undefined,10.1007/978-3-319-04489-7_3,0000-0002-4671-9884,"João Filipe Fragoso dos Santos",Scopus,
SCOPUS_ID:84877038360,"Dimensionality reduction in drought modelling",Journal,2013-05-15,27,1399-1410,N/A,N/A,08856087,undefined,10.1002/hyp.9300,0000-0002-4671-9884,"João Filipe Fragoso dos Santos",Scopus,
SCOPUS_ID:84878122921,"Precipitation thresholds for drought recognition: A further use of the standardized precipitation index, SPI",Journal,2013-01-01,172,3-14,N/A,N/A,17433541,"true, [9781845647124]",10.2495/RBM130011,0000-0002-4671-9884,"João Filipe Fragoso dos Santos",Scopus,
SCOPUS_ID:80255138382,"Regional Frequency Analysis of Droughts in Portugal",Journal,2011-11-01,25,3537-3558,N/A,N/A,09204741,undefined,10.1007/s11269-011-9869-z,0000-0002-4671-9884,"João Filipe Fragoso dos Santos",Scopus,
SCOPUS_ID:84865565437,"Regionalization of droughts in Portugal",Journal,2011-01-01,146,239-249,N/A,N/A,17433541,"true, [9781845645168]",10.2495/RM110211,0000-0002-4671-9884,"João Filipe Fragoso dos Santos",Scopus,
SCOPUS_ID:77949588816,"Spatial and temporal variability of droughts in Portugal",Journal,2010-03-01,46,undefined,N/A,N/A,00431397,undefined,10.1029/2009WR008071,0000-0002-4671-9884,"João Filipe Fragoso dos Santos",Scopus,
SCOPUS_ID:71649107108,"Trends in hydrologic time series",Journal,2009-01-01,124,185-195,N/A,N/A,17433541,"true, [9781845641986]",10.2495/RM090171,0000-0002-4671-9884,"João Filipe Fragoso dos Santos",Scopus,
SCOPUS_ID:38849113927,"Estimation of monthly stream flows based on the sequential water budget technique applied to the Thornthwaite potential evapotranspiration",Journal,2007-01-01,104,159-168,N/A,N/A,17433541,"true, [9781845640750]",10.2495/RM070161,0000-0002-4671-9884,"João Filipe Fragoso dos Santos",Scopus,
SCOPUS_ID:85088065396,"Thornthwaite and Penman-Monteith potential evapotranspiration and estimation of monthly stream flows","Conference Proceeding",2006-01-01,undefined,undefined,N/A,N/A,undefined,undefined,undefined,0000-0002-4671-9884,"João Filipe Fragoso dos Santos",Scopus,
SCOPUS_ID:85212238395,"Impact of different Cynara cardunculus L. extracts on the physicochemical, microbial, and sensory properties of Serpa cheese",Journal,2025-03-01,162,undefined,N/A,N/A,09586946,undefined,10.1016/j.idairyj.2024.106159,0000-0002-5108-0018,"João Jorge Mestre Dias",Scopus,
SCOPUS_ID:85213500948,"Comparative Study of Coagulation Dynamics: Cardoon Flower Extract vs. Chymosin",Journal,2024-12-01,5,817-827,N/A,N/A,undefined,undefined,10.3390/dairy5040059,0000-0002-5108-0018,"João Jorge Mestre Dias",Ambas,N/A
SCOPUS_ID:85192817895,"Influence of geographical origin in the physical and bioactive parameters of single origin dark chocolate",Journal,2024-10-01,250,2569-2580,N/A,N/A,14382377,undefined,10.1007/s00217-024-04558-0,0000-0002-5108-0018,"João Jorge Mestre Dias",Ambas,N/A
SCOPUS_ID:85178895235,"Valorization of baobab seeds (Adansonia digitata) as a coffee-like beverage: evaluation of roasting time on bioactive compounds",Journal,2024-04-01,61,727-733,N/A,N/A,00221155,undefined,10.1007/s13197-023-05873-2,0000-0002-5108-0018,"João Jorge Mestre Dias",Scopus,
SCOPUS_ID:85184714689,"Notes on the history and uses of thistles and Cynara cardunculus L. in Portugal",Journal,2024-01-01,28,undefined,N/A,N/A,undefined,undefined,10.32859/era.28.22.1-12,0000-0002-5108-0018,"João Jorge Mestre Dias",Scopus,
SCOPUS_ID:85156206503,"Development of a Functional Dark Chocolate with Baobab Pulp",Journal,2023-04-01,12,undefined,N/A,N/A,undefined,undefined,10.3390/foods12081711,0000-0002-5108-0018,"João Jorge Mestre Dias",Ambas,N/A
SCOPUS_ID:85148887568,"Impact of LAB from Serpa PDO Cheese in Cheese Models: Towards the Development of an Autochthonous Starter Culture",Journal,2023-02-01,12,undefined,N/A,N/A,undefined,undefined,10.3390/foods12040701,0000-0002-5108-0018,"João Jorge Mestre Dias",Ambas,N/A
SCOPUS_ID:85133625768,"Influence of cocoa origin on the nutritional characterization of chocolate",Journal,2022-10-01,248,2569-2577,N/A,N/A,14382377,undefined,10.1007/s00217-022-04070-3,0000-0002-5108-0018,"João Jorge Mestre Dias",Scopus,
SCOPUS_ID:85137751779,"Nutritional Properties of Baobab Pulp from Different Angolan Origins",Journal,2022-09-01,11,undefined,N/A,N/A,undefined,undefined,10.3390/plants11172272,0000-0002-5108-0018,"João Jorge Mestre Dias",Ambas,N/A
SCOPUS_ID:85136658653,"The use of cheese from Alentejo in Portuguese gastronomy: A travel through history",Journal,2022-09-01,29,undefined,N/A,N/A,1878450X,undefined,10.1016/j.ijgfs.2022.100579,0000-0002-5108-0018,"João Jorge Mestre Dias",Scopus,
SCOPUS_ID:85133329293,"Organoleptic Chemical Markers of Serpa PDO Cheese Specificity",Journal,2022-07-01,11,undefined,N/A,N/A,undefined,undefined,10.3390/foods11131898,0000-0002-5108-0018,"João Jorge Mestre Dias",Ambas,N/A
SCOPUS_ID:85128243114,"Effect of High Pressure on the Properties of Chocolate Fillings during Long-Term Storage",Journal,2022-04-01,11,undefined,N/A,N/A,undefined,undefined,10.3390/foods11070970,0000-0002-5108-0018,"João Jorge Mestre Dias",Ambas,N/A
SCOPUS_ID:85153634173,"Impact of Geographical Origin on Chocolate Microstructure, Phase Transition, and Fat Bloom",Book,2022-01-01,undefined,153-187,N/A,N/A,undefined,"true, [9783030901691, 9783030901684]",10.1007/978-3-030-90169-1_5,0000-0002-5108-0018,"João Jorge Mestre Dias",Scopus,
SCOPUS_ID:85087826142,"Evaluation of gas holes in “Queijo de Nisa” PDO cheese using computer vision",Journal,2021-03-01,58,1072-1080,N/A,N/A,00221155,undefined,10.1007/s13197-020-04621-0,0000-0002-5108-0018,"João Jorge Mestre Dias",Ambas,N/A
SCOPUS_ID:85090204013,"Evolution during three ripening stages of Évora cheese",Journal,2020-09-01,9,undefined,N/A,N/A,undefined,undefined,10.3390/foods9091140,0000-0002-5108-0018,"João Jorge Mestre Dias",Scopus,
SCOPUS_ID:85057109137,"Characterization of Cynara cardunculus L. flower from Alentejo as a coagulant agent for cheesemaking",Journal,2019-04-01,91,178-184,N/A,N/A,09586946,undefined,10.1016/j.idairyj.2018.09.010,0000-0002-5108-0018,"João Jorge Mestre Dias",Scopus,
SCOPUS_ID:85052113267,"Development of biscuits with green banana flour irradiated by <sup>60</sup>Co: Preservation in modified atmosphere packaging",Journal,2018-06-01,30,498-502,N/A,N/A,2079052X,undefined,10.9755/ejfa.2018.v30.i6.1720,0000-0002-5108-0018,"João Jorge Mestre Dias",Ambas,N/A
SCOPUS_ID:85031803096,"Evaluation of the impact of high pressure on the storage of filled traditional chocolates",Journal,2018-02-01,45,36-41,N/A,N/A,14668564,undefined,10.1016/j.ifset.2017.08.019,0000-0002-5108-0018,"João Jorge Mestre Dias",Ambas,N/A
SCOPUS_ID:85037048196,"Shelf-life of reduced-fat white chocolate fillings using iota-carrageenan",Journal,2017-11-01,29,893-898,N/A,N/A,2079052X,undefined,10.9755/ejfa.2017.v29.i11.1498,0000-0002-5108-0018,"João Jorge Mestre Dias",Ambas,N/A
SCOPUS_ID:84988927626,"Impact of olive oil usage on physical properties of chocolate fillings",Journal,2016-07-01,67,undefined,N/A,N/A,00173495,undefined,10.3989/gya.0323161,0000-0002-5108-0018,"João Jorge Mestre Dias",Ambas,N/A
SCOPUS_ID:84944515590,"Effect of hydrocolloids on low-fat chocolate fillings",Journal,2015-11-01,52,7209-7217,N/A,N/A,00221155,undefined,10.1007/s13197-015-1841-0,0000-0002-5108-0018,"João Jorge Mestre Dias",Ambas,N/A
SCOPUS_ID:4344686196,"Test of a small domestic boiler using different pellets",Journal,2004-12-01,27,531-539,N/A,N/A,09619534,undefined,10.1016/j.biombioe.2003.07.002,0000-0002-5108-0018,"João Jorge Mestre Dias",Ambas,N/A
SCOPUS_ID:85165976474,"Asp376Glu Mutation and Enhanced Metabolism Controlling the Resistance to ALS-Inhibiting Herbicides in Ixophorus unisetus (J. Presl) Schltdl. from the Bajio, Mexico",Journal,2023-07-01,13,undefined,N/A,N/A,undefined,undefined,10.3390/agronomy13071682,0000-0002-3313-887X,"João Martim de Portugal e Vasconcelos Fernandes",Scopus,
SCOPUS_ID:85161504534,"Convergent Adaptation of Multiple Herbicide Resistance to Auxin Mimics and ALS- and EPSPS-Inhibitors in Brassica rapa from North and South America",Journal,2023-06-01,12,undefined,N/A,N/A,undefined,undefined,10.3390/plants12112119,0000-0002-3313-887X,"João Martim de Portugal e Vasconcelos Fernandes",Scopus,
SCOPUS_ID:85160431684,"Filago pyramidata Tolerant to ALS-Inhibiting Herbicides: A New Invasive Weed in Olive Groves of Southern Spain",Journal,2023-05-01,13,undefined,N/A,N/A,undefined,undefined,10.3390/agronomy13051273,0000-0002-3313-887X,"João Martim de Portugal e Vasconcelos Fernandes",Scopus,
SCOPUS_ID:85149314288,"Target-site and non-target-site resistance mechanisms confer multiple resistance to glyphosate and 2,4-D in Carduus acanthoides",Journal,2023-04-01,191,undefined,N/A,N/A,00483575,undefined,10.1016/j.pestbp.2023.105371,0000-0002-3313-887X,"João Martim de Portugal e Vasconcelos Fernandes",Scopus,
